{
  "apmLockHash": null,
  "branch": "main",
  "codePin": null,
  "createdAt": "2026-04-02T00:00:00.000Z",
  "formatVersion": "0.1",
  "id": "fd9748041740574619ca41a6483aa57a66e0c9c4",
  "kind": "edit",
  "message": "compat fixture: left edit",
  "modules": [
    {
      "enabled": true,
      "name": "senior-eng",
      "source": {
        "kind": "local",
        "path": ".claude/agents/senior-eng.md"
      },
      "type": "chatmode"
    },
    {
      "enabled": true,
      "name": "Read",
      "source": {
        "kind": "builtin"
      },
      "type": "mcp"
    },
    {
      "enabled": true,
      "name": "Bash",
      "source": {
        "kind": "builtin"
      },
      "type": "mcp"
    },
    {
      "enabled": true,
      "name": "left-only",
      "source": {
        "kind": "local",
        "path": ".claude/skills/left-only/SKILL.md"
      },
      "type": "skill"
    }
  ],
  "parentIds": [
    "546a71f448f1ef7e12448585897fa3d97957c7aa"
  ]
}
