{
  "apmLockHash": null,
  "branch": "main",
  "codePin": null,
  "createdAt": "2026-04-04T00:00:00.000Z",
  "formatVersion": "0.1",
  "id": "450bfd5724dc3a73c8c828e56bc2cb515c6ff361",
  "kind": "edit",
  "message": "compat fixture: unknown source.kind",
  "modules": [
    {
      "enabled": true,
      "name": "senior-eng",
      "source": {
        "kind": "local",
        "path": ".claude/agents/senior-eng.md"
      },
      "type": "chatmode"
    },
    {
      "enabled": true,
      "name": "Read",
      "source": {
        "kind": "builtin"
      },
      "type": "mcp"
    },
    {
      "enabled": true,
      "name": "Bash",
      "source": {
        "kind": "builtin"
      },
      "type": "mcp"
    },
    {
      "enabled": true,
      "name": "private-bundle-skill",
      "source": {
        "bundleId": "internal/research-bundle-v3",
        "kind": "x-experimental-bundle",
        "ref": "abc123"
      },
      "type": "skill"
    }
  ],
  "parentIds": [
    "7d06314c53ca7113f9573b07ed8d69e79029aa6d"
  ]
}
