{
  "apmLockHash": null,
  "author": "ben@example.com",
  "branch": "main",
  "codePin": "71fe33aa01bc4d2e3f8970a14b5cdee2330aa901",
  "createdAt": "2026-04-23T09:12:30.000Z",
  "formatVersion": "0.1",
  "id": "0a2b7a6700d1bb346e911bd1ad24ef632462ce10",
  "kind": "init",
  "message": "init from recipe: research-base",
  "modules": [
    {
      "enabled": true,
      "name": "senior-eng",
      "source": {
        "kind": "local",
        "path": ".claude/agents/senior-eng.md"
      },
      "type": "chatmode"
    },
    {
      "enabled": true,
      "name": "research",
      "source": {
        "kind": "local",
        "path": ".claude/skills/research/SKILL.md"
      },
      "type": "skill",
      "version": "v0.4"
    },
    {
      "enabled": true,
      "name": "/plan",
      "source": {
        "kind": "local",
        "path": ".claude/commands/plan.md"
      },
      "type": "prompt"
    },
    {
      "enabled": true,
      "name": "format-pre",
      "source": {
        "kind": "local",
        "path": ".claude/settings.json"
      },
      "type": "hook"
    },
    {
      "enabled": true,
      "name": "Read",
      "source": {
        "kind": "builtin"
      },
      "type": "mcp"
    },
    {
      "enabled": true,
      "name": "Write",
      "source": {
        "kind": "builtin"
      },
      "type": "mcp"
    },
    {
      "enabled": true,
      "name": "Bash",
      "source": {
        "kind": "builtin"
      },
      "type": "mcp"
    }
  ],
  "parentIds": [],
  "version": "v0.1"
}
