{
  "apmLockHash": null,
  "author": "ben@example.com",
  "branch": "main",
  "codePin": "9c12aa44b30115ee61b2c7a890fdc31002ee30bb",
  "createdAt": "2026-04-25T18:00:00.000Z",
  "formatVersion": "0.2",
  "id": "ceabed2896c587ad32d3570e362cda2a313f00c0",
  "kind": "tag",
  "message": "promote v0.2",
  "modules": [
    {
      "enabled": true,
      "name": "senior-eng",
      "source": {
        "kind": "local",
        "path": ".claude/agents/senior-eng.md"
      },
      "type": "chatmode"
    },
    {
      "enabled": true,
      "name": "research",
      "source": {
        "kind": "local",
        "path": ".claude/skills/research/SKILL.md"
      },
      "type": "skill",
      "version": "v0.4"
    },
    {
      "enabled": true,
      "name": "/plan",
      "source": {
        "kind": "local",
        "path": ".claude/commands/plan.md"
      },
      "type": "prompt"
    },
    {
      "enabled": true,
      "name": "format-pre",
      "source": {
        "kind": "local",
        "path": ".claude/settings.json"
      },
      "type": "hook"
    },
    {
      "enabled": true,
      "name": "Read",
      "source": {
        "kind": "builtin"
      },
      "type": "mcp"
    },
    {
      "enabled": true,
      "name": "Write",
      "source": {
        "kind": "builtin"
      },
      "type": "mcp"
    },
    {
      "enabled": true,
      "name": "Bash",
      "source": {
        "kind": "builtin"
      },
      "type": "mcp"
    },
    {
      "enabled": true,
      "name": "format-post",
      "source": {
        "kind": "local",
        "path": ".claude/settings.json"
      },
      "type": "hook"
    }
  ],
  "parentIds": [
    "6e1de5f028f370c4bcfcf65daf9fa0caf12bbad4"
  ],
  "version": "v0.2"
}
