{
  "apmLockHash": "sha256:cc01e1deed66eeff7357c3e96fdacd7bd0d77f0a7fb96d7fdeee16e4d6416a1e",
  "author": "ben@example.com",
  "branch": "main",
  "codePin": "1100ffeebbccdd44aa5566778899aabbccddeeff",
  "createdAt": "2026-04-27T11:30:00.000Z",
  "formatVersion": "0.1",
  "id": "cb0e09d77c6679588b3013fad6fd8bac28da29c1",
  "kind": "auto",
  "message": "auto · summarize PR thread",
  "modules": [
    {
      "enabled": true,
      "name": "senior-eng",
      "source": {
        "depth": 1,
        "kind": "apm",
        "package": "microsoft/senior-eng",
        "resolvedCommit": "88aa11bb22cc33dd44ee55ff66001122334455aa"
      },
      "type": "chatmode"
    },
    {
      "enabled": true,
      "name": "research",
      "source": {
        "depth": 1,
        "kind": "apm",
        "package": "microsoft/research-skills",
        "resolvedCommit": "4d2e1aa00ff34b9b1cdef0a1b2c3d4e5f6a7b8c9"
      },
      "type": "skill",
      "version": "v0.5"
    },
    {
      "enabled": true,
      "name": "summarize",
      "source": {
        "depth": 1,
        "kind": "apm",
        "package": "microsoft/research-skills",
        "resolvedCommit": "4d2e1aa00ff34b9b1cdef0a1b2c3d4e5f6a7b8c9"
      },
      "type": "skill",
      "version": "v0.5"
    },
    {
      "enabled": true,
      "name": "/plan",
      "source": {
        "kind": "local",
        "path": ".claude/commands/plan.md"
      },
      "type": "prompt"
    },
    {
      "enabled": true,
      "name": "format-pre",
      "source": {
        "kind": "local",
        "path": ".claude/settings.json"
      },
      "type": "hook"
    },
    {
      "enabled": true,
      "name": "Read",
      "source": {
        "kind": "builtin"
      },
      "type": "mcp"
    },
    {
      "enabled": true,
      "name": "Bash",
      "source": {
        "kind": "builtin"
      },
      "type": "mcp"
    }
  ],
  "parentIds": [
    "4503c11c48b6eb49907b47ab60b733391cc78325"
  ],
  "sessionId": "sess-201"
}
