{
  "apmLockHash": null,
  "branch": "main",
  "codePin": null,
  "createdAt": "2026-04-01T00:00:00.000Z",
  "formatVersion": "0.1",
  "id": "546a71f448f1ef7e12448585897fa3d97957c7aa",
  "kind": "init",
  "message": "compat fixture: baseline",
  "modules": [
    {
      "enabled": true,
      "name": "senior-eng",
      "source": {
        "kind": "local",
        "path": ".claude/agents/senior-eng.md"
      },
      "type": "chatmode"
    },
    {
      "enabled": true,
      "name": "Read",
      "source": {
        "kind": "builtin"
      },
      "type": "mcp"
    },
    {
      "enabled": true,
      "name": "Bash",
      "source": {
        "kind": "builtin"
      },
      "type": "mcp"
    }
  ],
  "parentIds": []
}
