{
  "apmLockHash": null,
  "branch": "main",
  "codePin": null,
  "createdAt": "2026-04-03T00:00:00.000Z",
  "formatVersion": "0.1",
  "id": "7d06314c53ca7113f9573b07ed8d69e79029aa6d",
  "kind": "edit",
  "message": "compat fixture: merge of left and right",
  "modules": [
    {
      "enabled": true,
      "name": "senior-eng",
      "source": {
        "kind": "local",
        "path": ".claude/agents/senior-eng.md"
      },
      "type": "chatmode"
    },
    {
      "enabled": true,
      "name": "Read",
      "source": {
        "kind": "builtin"
      },
      "type": "mcp"
    },
    {
      "enabled": true,
      "name": "Bash",
      "source": {
        "kind": "builtin"
      },
      "type": "mcp"
    },
    {
      "enabled": true,
      "name": "left-only",
      "source": {
        "kind": "local",
        "path": ".claude/skills/left-only/SKILL.md"
      },
      "type": "skill"
    },
    {
      "enabled": true,
      "name": "right-only",
      "source": {
        "kind": "local",
        "path": ".claude/skills/right-only/SKILL.md"
      },
      "type": "skill"
    }
  ],
  "parentIds": [
    "fd9748041740574619ca41a6483aa57a66e0c9c4",
    "80fc531442cc09d55cca70c01357656a1ad96602"
  ]
}
