{
  "apmLockHash": null,
  "branch": "main",
  "codePin": null,
  "createdAt": "2026-04-05T00:01:00.000Z",
  "formatVersion": "0.1",
  "id": "8e5e637c9b30adb0fa9bdcc45c73464194d6a382",
  "kind": "auto",
  "message": "auto · session ctx-demo",
  "model": "claude-opus-4-7",
  "modules": [
    {
      "enabled": true,
      "name": "senior-eng",
      "source": {
        "kind": "local",
        "path": ".claude/agents/senior-eng.md"
      },
      "type": "chatmode"
    },
    {
      "enabled": true,
      "name": "Read",
      "source": {
        "kind": "builtin"
      },
      "type": "mcp"
    },
    {
      "enabled": true,
      "name": "Bash",
      "source": {
        "kind": "builtin"
      },
      "type": "mcp"
    }
  ],
  "parentIds": [
    "022ab1512bc00c09705f3f33cc21183256e6c370"
  ],
  "permissionMode": "default",
  "sessionId": "sess-context-demo"
}
